
SQL*Plus: Release 10.2.0.1.0 - Production on Tue Feb 18 14:10:33 2025

Copyright (c) 1982, 2005, Oracle.  All rights reserved.

SQL> conn c001
Enter password:
ERROR:
ORA-01017: invalid username/password; logon denied


SQL> conn c001
Enter password:
ERROR:
ORA-01017: invalid username/password; logon denied


SQL> conn b001
Enter password:
Connected.
SQL> CREATE TABLE CUSTOMER_INFO2(ORDER_ID INT,CUSTOMER_ID INT, EMPLOY_ID INT, ORDER_DATE DATE, SHIP_ID INT, ADDRESS VARCHAR(50));

Table created.

SQL> INSERT INTO CUSTOMER_INFO2 VALUES (10248,90,5,'7-APR-1996',3,'KOLKATA')
  2  ;

1 row created.

SQL> INSERT INTO CUSTOMER_INFO2 VALUES (10249,81,6,'7-MAY-1997',1,'ENGLAND');

1 row created.

SQL> INSERT INTO CUSTOMER_INFO2 VALUES (10250,34,4,'7-SEP-1996',2,'SATMAIL');

1 row created.

SQL> INSERT INTO CUSTOMER_INFO2 VALUES (10251,84,3,'17-NOV-1995',1,'BHABANICHAK');

1 row created.

SQL> INSERT INTO CUSTOMER_INFO2 VALUES (10252,76,4,'16-OCT-1997',2,'LONDON');

1 row created.

SQL> DELETE * FROM CUSTOMER_INFO2 WHERE CUSTOMER_ID=10251
  2  ;
DELETE * FROM CUSTOMER_INFO2 WHERE CUSTOMER_ID=10251
       *
ERROR at line 1:
ORA-00903: invalid table name


SQL> DELETE FROM CUSTOMER_INFO2 WHERE CUSTOMER_ID=10251
  2  ;

0 rows deleted.

SQL> DELETE FROM CUSTOMER_INFO2 WHERE ADDRESS='BHABANICHAK'
  2  ;

1 row deleted.

SQL> INSERT INTO CUSTOMER_INFO2 VALUES (10251,84,3,'12-NOV-1995',1,'BHABANICHAK');

1 row created.

SQL> SELECT * FROM CUSTOMER_INFO2;

  ORDER_ID CUSTOMER_ID  EMPLOY_ID ORDER_DAT    SHIP_ID
---------- ----------- ---------- --------- ----------
ADDRESS
--------------------------------------------------
     10248          90          5 07-APR-96          3
KOLKATA

     10249          81          6 07-MAY-97          1
ENGLAND

     10250          34          4 07-SEP-96          2
SATMAIL


  ORDER_ID CUSTOMER_ID  EMPLOY_ID ORDER_DAT    SHIP_ID
---------- ----------- ---------- --------- ----------
ADDRESS
--------------------------------------------------
     10252          76          4 16-OCT-97          2
LONDON

     10251          84          3 12-NOV-95          1
BHABANICHAK


SQL> SETLINE 500;
SP2-0734: unknown command beginning "SETLINE 50..." - rest of line ignored.
SQL> SET LINE 500;
SQL> SELECT * FROM CUSTOMER_INFO2;

  ORDER_ID CUSTOMER_ID  EMPLOY_ID ORDER_DAT    SHIP_ID ADDRESS
---------- ----------- ---------- --------- ---------- --------------------------------------------------
     10248          90          5 07-APR-96          3 KOLKATA
     10249          81          6 07-MAY-97          1 ENGLAND
     10250          34          4 07-SEP-96          2 SATMAIL
     10252          76          4 16-OCT-97          2 LONDON
     10251          84          3 12-NOV-95          1 BHABANICHAK

SQL> ALTER TABLE CUSTOMER_INFO2 ADD CUSTOMER_NAME VARCHAR(30);

Table altered.

SQL> SELECT * FROM CUSTOMER_INFO2;

  ORDER_ID CUSTOMER_ID  EMPLOY_ID ORDER_DAT    SHIP_ID ADDRESS                                            CUSTOMER_NAME
---------- ----------- ---------- --------- ---------- -------------------------------------------------- ------------------------------
     10248          90          5 07-APR-96          3 KOLKATA
     10249          81          6 07-MAY-97          1 ENGLAND
     10250          34          4 07-SEP-96          2 SATMAIL
     10252          76          4 16-OCT-97          2 LONDON
     10251          84          3 12-NOV-95          1 BHABANICHAK

SQL> UPDATE CUSTOMER_INFO2 SET CUSTOMER_NAME='SAYAN MAITY' WHERE SHIP_ID=3;

1 row updated.

SQL> SELECT * FROM CUSTOMER_INFO2;

  ORDER_ID CUSTOMER_ID  EMPLOY_ID ORDER_DAT    SHIP_ID ADDRESS                                            CUSTOMER_NAME
---------- ----------- ---------- --------- ---------- -------------------------------------------------- ------------------------------
     10248          90          5 07-APR-96          3 KOLKATA                                            SAYAN MAITY
     10249          81          6 07-MAY-97          1 ENGLAND
     10250          34          4 07-SEP-96          2 SATMAIL
     10252          76          4 16-OCT-97          2 LONDON
     10251          84          3 12-NOV-95          1 BHABANICHAK

SQL> UPDATE CUSTOMER_INFO2 SET CUSTOMER_NAME='RUPAM GIRI' WHERE SHIP_ID=1;

2 rows updated.

SQL> UPDATE CUSTOMER_INFO2 SET CUSTOMER_NAME='ABHIJIT NANDA' WHERE ADDRESS='SATMAIL';

1 row updated.

SQL> UPDATE CUSTOMER_INFO2 SET CUSTOMER_NAME='PALLAB MONDAL' WHERE ADDRESS='LONDON';

1 row updated.

SQL> UPDATE CUSTOMER_INFO2 SET CUSTOMER_NAME='SAYAN MAISHAL' WHERE ADDRESS='BHABANICHAK';

1 row updated.

SQL> SELECT * FROM CUSTOMER_INFO2;

  ORDER_ID CUSTOMER_ID  EMPLOY_ID ORDER_DAT    SHIP_ID ADDRESS                                            CUSTOMER_NAME
---------- ----------- ---------- --------- ---------- -------------------------------------------------- ------------------------------
     10248          90          5 07-APR-96          3 KOLKATA                                            SAYAN MAITY
     10249          81          6 07-MAY-97          1 ENGLAND                                            RUPAM GIRI
     10250          34          4 07-SEP-96          2 SATMAIL                                            ABHIJIT NANDA
     10252          76          4 16-OCT-97          2 LONDON                                             PALLAB MONDAL
     10251          84          3 12-NOV-95          1 BHABANICHAK                                        SAYAN MAISHAL

SQL> SELECT * FROM CUSTOMER_INFO2 WHERE ORDER_DATE BETWEEN '12-NOV-1995' AND '7-SEP-1996';

  ORDER_ID CUSTOMER_ID  EMPLOY_ID ORDER_DAT    SHIP_ID ADDRESS                                            CUSTOMER_NAME
---------- ----------- ---------- --------- ---------- -------------------------------------------------- ------------------------------
     10248          90          5 07-APR-96          3 KOLKATA                                            SAYAN MAITY
     10250          34          4 07-SEP-96          2 SATMAIL                                            ABHIJIT NANDA
     10251          84          3 12-NOV-95          1 BHABANICHAK                                        SAYAN MAISHAL

SQL> SELECT * FROM CUSTOMER_INFO2 WHERE SHIP_ID BETWEEN '3' AND '2';

no rows selected

SQL> SELECT * FROM CUSTOMER_INFO2 WHERE SHIP_ID IN(3,2);

  ORDER_ID CUSTOMER_ID  EMPLOY_ID ORDER_DAT    SHIP_ID ADDRESS                                            CUSTOMER_NAME
---------- ----------- ---------- --------- ---------- -------------------------------------------------- ------------------------------
     10248          90          5 07-APR-96          3 KOLKATA                                            SAYAN MAITY
     10250          34          4 07-SEP-96          2 SATMAIL                                            ABHIJIT NANDA
     10252          76          4 16-OCT-97          2 LONDON                                             PALLAB MONDAL

SQL> SELECT * FROM CUSTOMER_INFO2 WHERE ADDRESS IN('SATMAIL','BHABANICHAK');

  ORDER_ID CUSTOMER_ID  EMPLOY_ID ORDER_DAT    SHIP_ID ADDRESS                                            CUSTOMER_NAME
---------- ----------- ---------- --------- ---------- -------------------------------------------------- ------------------------------
     10250          34          4 07-SEP-96          2 SATMAIL                                            ABHIJIT NANDA
     10251          84          3 12-NOV-95          1 BHABANICHAK                                        SAYAN MAISHAL

SQL> SELECT * FROM CUSTOMER_INFO2 WHERE EMPLOY_ID BETWEEN 3 AND 6;

  ORDER_ID CUSTOMER_ID  EMPLOY_ID ORDER_DAT    SHIP_ID ADDRESS                                            CUSTOMER_NAME
---------- ----------- ---------- --------- ---------- -------------------------------------------------- ------------------------------
     10248          90          5 07-APR-96          3 KOLKATA                                            SAYAN MAITY
     10249          81          6 07-MAY-97          1 ENGLAND                                            RUPAM GIRI
     10250          34          4 07-SEP-96          2 SATMAIL                                            ABHIJIT NANDA
     10252          76          4 16-OCT-97          2 LONDON                                             PALLAB MONDAL
     10251          84          3 12-NOV-95          1 BHABANICHAK                                        SAYAN MAISHAL

SQL> SELECT * FROM CUSTOMER_INFO2 WHERE ADDRESS NOT IN('KOLKATA','LONDON');

  ORDER_ID CUSTOMER_ID  EMPLOY_ID ORDER_DAT    SHIP_ID ADDRESS                                            CUSTOMER_NAME
---------- ----------- ---------- --------- ---------- -------------------------------------------------- ------------------------------
     10249          81          6 07-MAY-97          1 ENGLAND                                            RUPAM GIRI
     10250          34          4 07-SEP-96          2 SATMAIL                                            ABHIJIT NANDA
     10251          84          3 12-NOV-95          1 BHABANICHAK                                        SAYAN MAISHAL

SQL> SELECT * FROM CUSTOMER_INFO2 WHERE EMPLOY_ID 4 AND ORDER_DATE '16-OCT-1997';
SELECT * FROM CUSTOMER_INFO2 WHERE EMPLOY_ID 4 AND ORDER_DATE '16-OCT-1997'
                                             *
ERROR at line 1:
ORA-00920: invalid relational operator


SQL> SELECT * FROM CUSTOMER_INFO2 WHERE EMPLOY_ID= 4 AND ORDER_DATE= '16-OCT-1997';

  ORDER_ID CUSTOMER_ID  EMPLOY_ID ORDER_DAT    SHIP_ID ADDRESS                                            CUSTOMER_NAME
---------- ----------- ---------- --------- ---------- -------------------------------------------------- ------------------------------
     10252          76          4 16-OCT-97          2 LONDON                                             PALLAB MONDAL

SQL> SELECT * FROM CUSTOMER_INFO2 WHERE SHIP_ID IN(3,2);

  ORDER_ID CUSTOMER_ID  EMPLOY_ID ORDER_DAT    SHIP_ID ADDRESS                                            CUSTOMER_NAME
---------- ----------- ---------- --------- ---------- -------------------------------------------------- ------------------------------
     10248          90          5 07-APR-96          3 KOLKATA                                            SAYAN MAITY
     10250          34          4 07-SEP-96          2 SATMAIL                                            ABHIJIT NANDA
     10252          76          4 16-OCT-97          2 LONDON                                             PALLAB MONDAL

SQL> ALTER TABLE CUSTOMER_INFO2 RANAME COLUMN ADDRESS TO CUSTOMER_CITY;
ALTER TABLE CUSTOMER_INFO2 RANAME COLUMN ADDRESS TO CUSTOMER_CITY
                           *
ERROR at line 1:
ORA-01735: invalid ALTER TABLE option


SQL> ALTER TABLE CUSTOMER_INFO2 RENAME COLUMN ADDRESS TO CUSTOMER_CITY;

Table altered.

SQL> SELECT * FROM CUSTOMER_INFO2;

  ORDER_ID CUSTOMER_ID  EMPLOY_ID ORDER_DAT    SHIP_ID CUSTOMER_CITY                                      CUSTOMER_NAME
---------- ----------- ---------- --------- ---------- -------------------------------------------------- ------------------------------
     10248          90          5 07-APR-96          3 KOLKATA                                            SAYAN MAITY
     10249          81          6 07-MAY-97          1 ENGLAND                                            RUPAM GIRI
     10250          34          4 07-SEP-96          2 SATMAIL                                            ABHIJIT NANDA
     10252          76          4 16-OCT-97          2 LONDON                                             PALLAB MONDAL
     10251          84          3 12-NOV-95          1 BHABANICHAK                                        SAYAN MAISHAL

SQL> UPDATE CUSTOMER_INFO2 SET CUSTOMER_CITY='CANDA' WHERE ADDRESS='BHABANICHAK';
UPDATE CUSTOMER_INFO2 SET CUSTOMER_CITY='CANDA' WHERE ADDRESS='BHABANICHAK'
                                                      *
ERROR at line 1:
ORA-00904: "ADDRESS": invalid identifier


SQL> UPDATE CUSTOMER_INFO2 SET CUSTOMER_CITY='CANADA' WHERE CUSTOMER_CITY='BHABANICHAK';

1 row updated.

SQL> SELECT * FROM CUSTOMER_INFO2;

  ORDER_ID CUSTOMER_ID  EMPLOY_ID ORDER_DAT    SHIP_ID CUSTOMER_CITY                                      CUSTOMER_NAME
---------- ----------- ---------- --------- ---------- -------------------------------------------------- ------------------------------
     10248          90          5 07-APR-96          3 KOLKATA                                            SAYAN MAITY
     10249          81          6 07-MAY-97          1 ENGLAND                                            RUPAM GIRI
     10250          34          4 07-SEP-96          2 SATMAIL                                            ABHIJIT NANDA
     10252          76          4 16-OCT-97          2 LONDON                                             PALLAB MONDAL
     10251          84          3 12-NOV-95          1 CANADA                                             SAYAN MAISHAL

SQL> COMMIT;

Commit complete.

SQL> SELECT * FROM CUSTOMER_INFO2 WHERE SHIP_ID BETWEEN '3' OR '2';
SELECT * FROM CUSTOMER_INFO2 WHERE SHIP_ID BETWEEN '3' OR '2'
                                                       *
ERROR at line 1:
ORA-00905: missing keyword


SQL> SELECT * FROM CUSTOMER_INFO2 WHERE SHIP_ID BETWEEN 3 OR 2;
SELECT * FROM CUSTOMER_INFO2 WHERE SHIP_ID BETWEEN 3 OR 2
                                                     *
ERROR at line 1:
ORA-00905: missing keyword


SQL> SELECT * FROM CUSTOMER_INFO2 WHERE SHIP_ID= 3 OR SHIP_ID= 2;

  ORDER_ID CUSTOMER_ID  EMPLOY_ID ORDER_DAT    SHIP_ID CUSTOMER_CITY                                      CUSTOMER_NAME
---------- ----------- ---------- --------- ---------- -------------------------------------------------- ------------------------------
     10248          90          5 07-APR-96          3 KOLKATA                                            SAYAN MAITY
     10250          34          4 07-SEP-96          2 SATMAIL                                            ABHIJIT NANDA
     10252          76          4 16-OCT-97          2 LONDON                                             PALLAB MONDAL

SQL>